{
  "schema_version": 1,
  "skill_version": "2.4.0",
  "sinks": [
    {
      "id": "deck:sink:build-output",
      "sink_file": "server/api/decks/[id]/build-output/[...].get.ts",
      "line": 18,
      "kind": "file",
      "framework": "Nuxt",
      "serves_resource": "Deck",
      "reachable_via": ["/api/decks/{id}/build-output/index.html"],
      "guarded_paths": [
        {"branch_id": "authed", "condition": "session present", "enforced_gate": "role:viewer + canAccessDeck", "serves_bytes": true}
      ],
      "coverage": "complete"
    }
  ],
  "dismissed": []
}
